{
  "$schema": "/schemas/declarative_decoder_runtime.schema.v1.json",
  "schema": "declarative-decoder-runtime.v1",
  "version": "0.1.0",
  "sourceProtocolIds": ["orca-whirlpool-mainnet"],
  "label": "Orca Whirlpool Declarative Runtime",
  "programId": "$protocol.programId",
  "decoderArtifacts": {
    "orca_whirlpool": {
      "kind": "generated_idl_decoder",
      "family": "codama",
      "codamaPath": "/codama/orca-whirlpool.json",
      "artifact": "orca_whirlpool"
    }
  },
  "sources": {
    "orca_whirlpool_crawler": {
      "kind": "rpc_transaction_crawler",
      "programId": "$protocol.programId",
      "commitment": "confirmed",
      "decoderRef": "orca_whirlpool",
      "decodeTargets": [
        "instruction",
        "log_event",
        "account"
      ],
      "filters": {}
    }
  },
  "matchRules": [
    {
      "source": "orca_whirlpool_crawler",
      "match": {
        "decodedType": "event",
        "name": "TradedEvent"
      },
      "pipeline": "whirlpool_trade"
    },
    {
      "source": "orca_whirlpool_crawler",
      "match": {
        "decodedType": "account",
        "name": "Whirlpool"
      },
      "pipeline": "whirlpool_snapshot"
    },
    {
      "source": "orca_whirlpool_crawler",
      "match": {
        "decodedType": "account",
        "name": "Position"
      },
      "pipeline": "position_snapshot"
    }
  ],
  "pipelines": {
    "whirlpool_trade": {
      "extract": {
        "pool": "$decoded.whirlpool",
        "marketType": "whirlpool",
        "trader": "$update.signer",
        "aToB": "$decoded.a_to_b",
        "inputAmountAtomic": "$decoded.input_amount",
        "outputAmountAtomic": "$decoded.output_amount",
        "inputTransferFeeAtomic": "$decoded.input_transfer_fee",
        "outputTransferFeeAtomic": "$decoded.output_transfer_fee",
        "preSqrtPrice": "$decoded.pre_sqrt_price",
        "postSqrtPrice": "$decoded.post_sqrt_price",
        "lpFeeAtomic": "$decoded.lp_fee",
        "protocolFeeAtomic": "$decoded.protocol_fee",
        "signature": "$update.signature",
        "slot": "$update.slot",
        "observedAt": "$update.eventTime"
      },
      "compute": [
        {
          "ref": "logic.if_then_else",
          "inputs": {
            "condition": "$ctx.aToB",
            "then_value": "a_to_b",
            "else_value": "b_to_a"
          },
          "output": "side"
        }
      ],
      "emit": {
        "record": {
          "recordKind": "event",
          "recordName": "SwapEvent",
          "retention": "8d",
          "subjectId": "$ctx.pool",
          "resourceId": "$ctx.pool",
          "participantId": "$ctx.trader",
          "signature": "$ctx.signature",
          "slot": "$ctx.slot",
          "eventTime": "$ctx.observedAt",
          "payload": {
            "pool": "$ctx.pool",
            "marketType": "$ctx.marketType",
            "trader": "$ctx.trader",
            "side": "$side",
            "aToB": "$ctx.aToB",
            "inputAmountAtomic": "$ctx.inputAmountAtomic",
            "outputAmountAtomic": "$ctx.outputAmountAtomic",
            "inputTransferFeeAtomic": "$ctx.inputTransferFeeAtomic",
            "outputTransferFeeAtomic": "$ctx.outputTransferFeeAtomic",
            "preSqrtPrice": "$ctx.preSqrtPrice",
            "postSqrtPrice": "$ctx.postSqrtPrice",
            "lpFeeAtomic": "$ctx.lpFeeAtomic",
            "protocolFeeAtomic": "$ctx.protocolFeeAtomic",
            "signature": "$ctx.signature",
            "slot": "$ctx.slot",
            "observedAt": "$ctx.observedAt"
          }
        },
        "state": {
          "recordKind": "state",
          "recordName": "WhirlpoolTradeState",
          "retention": "30d",
          "subjectId": "$ctx.pool",
          "resourceId": "$ctx.pool",
          "signature": "$ctx.signature",
          "slot": "$ctx.slot",
          "eventTime": "$ctx.observedAt",
          "payload": {
            "pool": "$ctx.pool",
            "marketType": "$ctx.marketType",
            "side": "$side",
            "aToB": "$ctx.aToB",
            "inputAmountAtomic": "$ctx.inputAmountAtomic",
            "outputAmountAtomic": "$ctx.outputAmountAtomic",
            "inputTransferFeeAtomic": "$ctx.inputTransferFeeAtomic",
            "outputTransferFeeAtomic": "$ctx.outputTransferFeeAtomic",
            "preSqrtPrice": "$ctx.preSqrtPrice",
            "postSqrtPrice": "$ctx.postSqrtPrice",
            "lpFeeAtomic": "$ctx.lpFeeAtomic",
            "protocolFeeAtomic": "$ctx.protocolFeeAtomic",
            "observedAt": "$ctx.observedAt"
          }
        }
      }
    },
    "whirlpool_snapshot": {
      "extract": {
        "pool": "$update.pubkey",
        "marketType": "whirlpool",
        "tokenMintA": "$decoded.token_mint_a",
        "tokenMintB": "$decoded.token_mint_b",
        "tokenVaultA": "$decoded.token_vault_a",
        "tokenVaultB": "$decoded.token_vault_b",
        "tickSpacing": "$decoded.tick_spacing",
        "feeRateRaw": "$decoded.fee_rate",
        "liquidity": "$decoded.liquidity",
        "tickCurrentIndex": "$decoded.tick_current_index",
        "sqrtPrice": "$decoded.sqrt_price",
        "observedAt": "$update.eventTime"
      },
      "compute": [
        {
          "ref": "math.safe_div",
          "inputs": {
            "dividend": "$ctx.feeRateRaw",
            "divisor": 100
          },
          "output": "feeRateBps"
        }
      ],
      "emit": {
        "state": {
          "recordKind": "account",
          "recordName": "Whirlpool",
          "retention": "90d",
          "subjectId": "$ctx.pool",
          "resourceId": "$ctx.pool",
          "eventTime": "$ctx.observedAt",
          "payload": {
            "pool": "$ctx.pool",
            "marketType": "$ctx.marketType",
            "tokenMintA": "$ctx.tokenMintA",
            "tokenMintB": "$ctx.tokenMintB",
            "tokenVaultA": "$ctx.tokenVaultA",
            "tokenVaultB": "$ctx.tokenVaultB",
            "tickSpacing": "$ctx.tickSpacing",
            "feeRateRaw": "$ctx.feeRateRaw",
            "feeRateBps": "$feeRateBps",
            "liquidity": "$ctx.liquidity",
            "tickCurrentIndex": "$ctx.tickCurrentIndex",
            "sqrtPrice": "$ctx.sqrtPrice",
            "observedAt": "$ctx.observedAt"
          }
        }
      }
    },
    "position_snapshot": {
      "extract": {
        "position": "$update.pubkey",
        "whirlpool": "$decoded.whirlpool",
        "positionMint": "$decoded.position_mint",
        "liquidity": "$decoded.liquidity",
        "tickLowerIndex": "$decoded.tick_lower_index",
        "tickUpperIndex": "$decoded.tick_upper_index",
        "feeGrowthCheckpointA": "$decoded.fee_growth_checkpoint_a",
        "feeOwedA": "$decoded.fee_owed_a",
        "feeGrowthCheckpointB": "$decoded.fee_growth_checkpoint_b",
        "feeOwedB": "$decoded.fee_owed_b",
        "observedAt": "$update.eventTime"
      },
      "emit": {
        "state": {
          "recordKind": "account",
          "recordName": "Position",
          "retention": "90d",
          "subjectId": "$ctx.position",
          "resourceId": "$ctx.position",
          "eventTime": "$ctx.observedAt",
          "payload": {
            "position": "$ctx.position",
            "whirlpool": "$ctx.whirlpool",
            "positionMint": "$ctx.positionMint",
            "liquidity": "$ctx.liquidity",
            "tickLowerIndex": "$ctx.tickLowerIndex",
            "tickUpperIndex": "$ctx.tickUpperIndex",
            "feeGrowthCheckpointA": "$ctx.feeGrowthCheckpointA",
            "feeOwedA": "$ctx.feeOwedA",
            "feeGrowthCheckpointB": "$ctx.feeGrowthCheckpointB",
            "feeOwedB": "$ctx.feeOwedB",
            "observedAt": "$ctx.observedAt"
          }
        }
      }
    }
  }
}
